"Name","Hometown","Position","Stars","Grade","School"
"Justin EllisVideo | Scouts Report","Monroe, LANeville High School","OG","","NR","Signed"
"Tyrone  GeneralVideo | Scouts Report","Greenbelt, MDEleanor Roosevelt High School","RB","","NR","List"
"Dimeko PriceVideo | Scouts Report","Battle Creek, MILakeview High School","RB","","NR","List"
"Chase DubeVideo | Scouts Report","Lexington, TXLexington High School","OG","","NR","List"
"Tony HarrisVideo | Scouts Report","Cincinnati, OHMoeller High School","WR","","NR","List"
"Tim MacLeanVideo | Scouts Report","Detroit, MIDetroit Country Day School","OT","","NR","List"
"Brian RobinsonVideo | Scouts Report","Chesapeake, VAGreenbrier Christian Academy","QB","","NR","List"
"Cameron  WhiteVideo | Scouts Report","Antioch, ILAntioch Community High School","RB","","NR","List"
"Richard GaleaiVideo | Scouts Report","Euless, TXTrinity High School","ATH","","NR","Signed"
"T.J. LeeVideo | Scouts Report","Seattle, WAWest Seattle High School","CB","","NR","Signed12/18/2010"
"Ja'Gared DavisVideo | Scouts Report","Crockett, TXCrockett High School","OLB","","NR","Signed"
"Sammy  SeamsterVideo | Scouts Report","Ooltewah, TNOoltewah High School","ATH","","NR","Signed"
"Ryan  ZirbelVideo | Scouts Report","Saugus, CASaugus High School","RB","","NR","List"
"Deondrick PinaVideo | Scouts Report","Ellaville, GASchley High School","CB","","NR","List"
"Spencer BruceVideo | Scouts Report","Gillette, WYCampbell County High School","DE","","NR","Signed"
"Khairi  UsherVideo | Scouts Report","Meridian, MSMeridian High School","CB","","NR","Signed"
"Koby MillerVideo | Scouts Report","Honaker, VAHonaker High School","OT","","NR","List"
"Evan EngwallVideo | Scouts Report","Mesa, AZRed Mountain High School","K","","NR","Signed01/07/2011"
"Eugene MooreVideo | Scouts Report","Augusta, GALucy C. Laney High School","RB","","NR","List"
"Paul HarrisVideo | Scouts Report","Baton Rouge, LATara High School","QB","","NR","List"
"Jake LembkeVideo | Scouts Report","New Lenox, ILProvidence Catholic High School","ATH","","NR","List"
"Brent MichaelsVideo | Scouts Report","Lake Havasu, AZLake Havasu High School","RB","","NR","Committed"
"Dominique SashingtonVideo | Scouts Report","Alameda, CAEncinal High School","CB","","NR","List"
"Carlos  HiltonVideo | Scouts Report","Youngstown, OHEast High School","CB","","NR","List"
"Brett  JohnsonVideo | Scouts Report","North Augusta, SCNorth Augusta High School","ILB","","NR","List"
"T.J. KowalVideo | Scouts Report","Wayne, NJDePaul Catholic High School","OLB","","NR","List"
"Germain MartinezVideo | Scouts Report","Kenner, LAArchbishop Rummel School For Boys","DT","","NR","List"
"Dylan RedaVideo | Scouts Report","San Clemente, CASan Clemente High School","ILB","","NR","Signed"
"Jeremy RobinsonVideo | Scouts Report","Charlottesville, VAAlbemarle High School","QB","","NR","List"
"Jake LongVideo | Scouts Report","Elkhorn, NEElkhorn High School","TE","","NR","List"
"B.J. DardarVideo | Scouts Report","Montegut, LASouth Terrebonne High School","RB","","NR","List"
"Darius HowellVideo | Scouts Report","Valdosta, GALowndes High School","S","","NR","List"
"Chris  WalkerVideo | Scouts Report","Cypress, TXCypress Woods High School","RB","","NR","List"
"Kevin FoggVideo | Scouts Report","Apex, NCApex High School","RB","","NR","List"
"Marte SearsVideo | Scouts Report","Fresno, CAMcLane High School","S","","NR","List"
"Cornelius LucasVideo | Scouts Report","New Orleans, LAEdna Karr High School","OT","","NR","Signed"
"George  Brown Video | Scouts Report","Kershaw, SCNorth Central High School","ATH","","NR","List"
"Don CopeVideo | Scouts Report","Maryville, TNWilliam Blount High School","WR","","NR","List"
"Stephen  JohnsonVideo | Scouts Report","Baltimore, MDBaltimore City College High School","RB","","NR","List"
"Jeffrey BediakoVideo | Scouts Report","Boise, IDBoise High School","OLB","","NR","Signed"
"Scott OoleyVideo | Scouts Report","Hoschton, GAMill Creek High School","ILB","","NR","List"
"D'Andre BrownVideo | Scouts Report","Baltimore, MDEdmondson-Westside High School","S","","NR","List"
"Taron BrownVideo | Scouts Report","Detroit, MINorthwestern High School","RB","","NR","List"
"John ClarkVideo | Scouts Report","Oxford, ALOxford High School","DE","","NR","Signed"
"Saei HuihuiVideo | Scouts Report","Las Vegas, NVDel Sol High School","QB","","NR","List"
"Keegan  RayVideo | Scouts Report","Chapel Hill, NCChapel Hill High School","DE","","NR","List"
"Winfred StricklandVideo | Scouts Report","Cocoa, FLCocoa High School","CB","","NR","Signed"
"Nick  WilliamsVideo | Scouts Report","Spring Valley, CAMonte Vista High School","RB","","NR","List"
"David GilbertsonVideo | Scouts Report","Redmond, WARedmond High School","QB","","NR","List"
"Phillip LefebvreVideo | Scouts Report","Raleigh, NCHargrave Military Academy","TE(POST)","","NR","List"
"Mitch SinglerVideo | Scouts Report","Medford, ORSouth Medford High School","WR","","NR","List"
"Harrison WaidVideo | Scouts Report","Sunnyvale, CAFremont High School","K","","NR","Signed"
"Shawn ReedVideo | Scouts Report","Kailua, HIKalaheo High School","ILB","","NR","Committed"
"John AsplundVideo | Scouts Report","Bellingham, WABellingham High School","DT","","NR","Signed12/18/2010"
"Ontario BrownVideo | Scouts Report","Montgomery, ALJefferson Davis High School","WR","","NR","List"
"Travis WattsVideo | Scouts Report","Baton Rouge, LACentral High School","OG","","NR","List"
"Pierre VaughnVideo | Scouts Report","Nashville, ARNashville High School","QB","","NR","List"
"Chase StuckeyVideo | Scouts Report","Salado, TXSalado High School","OT","","NR","List"
"Chazz  MitchellVideo | Scouts Report","Las Vegas, NVCimarron-Memorial High School","ATH","","NR","List"
"Joshua WilsonVideo | Scouts Report","Denver, NCEast Lincoln High School","QB","","NR","List"
"Trey GreshVideo | Scouts Report","Blacksburg, VABlacksburg High School","QB","","NR","List"
"Deauntay  PayneVideo | Scouts Report","Tupelo, MSTupelo High School","DT","","NR","List"
"Cody WallaceVideo | Scouts Report","Moorestown, NJMoorestown High School","OT","","NR","Signed"
"Kevin ByrneVideo | Scouts Report","Mashpee, MAMashpee High School","DT","","NR","Signed12/18/2010"
"Brandon ArnoldVideo | Scouts Report","Union City, CAJames Logan High School","S","","NR","List"
"Zeke RiserVideo | Scouts Report","La Vernia, TXLa Vernia High School","DE","","NR","Signed"
"Tyler YoungVideo | Scouts Report","Louisville, KYFern Creek High School","OT","","NR","List"
"Robert MontoyaVideo | Scouts Report","Midland, TXMidland High School","OG","","NR","List"
"Ladarious PortisVideo | Scouts Report","Laurel, MSLaurel High School Watkins Campus","CB","","NR","List"
"Nat BerheVideo | Scouts Report","Colton, CAColton High School","S","","NR","Signed"
"Duone MaxwellVideo | Scouts Report","Kansas City, MOWashington High School","RB","","NR","List"
"Eddie GeneralVideo | Scouts Report","Ocala, FLTrinity Catholic High School","OLB","","NR","List"
"Dominic MainelloVideo | Scouts Report","Fort Mitchell, KYBeechwood High School","OG","","NR","Signed"
"Branden  GriffinVideo | Scouts Report","Atlanta, GAWestlake High School","ILB","","NR","List"
"Cameron SandquistVideo | Scouts Report","Redmond, WARedmond High School","WR","","NR","List"
"Darrell MartinVideo | Scouts Report","Lithonia, GAMartin Luther King High School","OT","","NR","Signed"
"James WatkinsVideo | Scouts Report","Norwood, NCSouth Stanly High School","ILB","","NR","List"
"Demetri HaynesVideo | Scouts Report","Troy, ALCharles Henderson High School","CB","","NR","List"
"Patrick MellottVideo | Scouts Report","Cincinnati, OHElder High School","WR","","NR","List"
"Travis SavilleVideo | Scouts Report","Glen Ellyn, ILCollege of Dupage","ILB","","NR","List"
"Jeremy BrownVideo | Scouts Report","Irving, TXMacArthur High School","OLB","","NR","List"
"Reuben ThomasVideo | Scouts Report","Pasadena, CAJohn Muir High School","CB(LQ)","","NR","Signed"
"Kyle LavoieVideo | Scouts Report","Pensacola, FLPensacola High School","QB","","NR","List"
"Denzell  BassVideo | Scouts Report","Sharpsburg, GAEast Coweta High School","ILB","","NR","List"
"Jeremy MartinVideo | Scouts Report","Brentwood, TNBrentwood Academy","S","","NR","List"
"Breck LewisVideo | Scouts Report","Spanish Fork, UTSpanish Fork High School","QB","","NR","List"
"Trey  BosticVideo | Scouts Report","Concord, NCCentral Cabarrus High School","RB","","NR","List"
"MacLean JoeVideo | Scouts Report","Detroit, MIDetroit Country Day School","S","","NR","List"
"Woodward TanaVideo | Scouts Report","Honolulu, HIMcKinley High School","TE","","NR","List"
"Natreon MooseVideo | Scouts Report","Deer Park, TXDeer Park High School","WR","","NR","List"
"Darrell WardVideo | Scouts Report","Homestead, FLHomestead Senior High School","OLB","","NR","List"
"Michael EasleyVideo | Scouts Report","Stratford, CTFrank Scott Bunnell High School","S","","NR","List"
"Jeff CrissmanVideo | Scouts Report","Huntington Beach, CAEdison High School","WR","","NR","List"
"Cedric BrownVideo | Scouts Report","Thomasville, GAThomasville High School","OG","","NR","List"
"Darryl MoorerVideo | Scouts Report","Demopolis, ALDemopolis High School","CB","","NR","List"
"Henry Vande HeyVideo | Scouts Report","Wrightstown, WIWrightstown High School","DT","","NR","List"
"Bryce ShermanVideo | Scouts Report","Winston-Salem, NCCarver High School","ATH","","NR","List"
"Austin  HumbardVideo | Scouts Report","Bryant, ARBryant High School","ILB","","NR","List"
"Jared DavisVideo | Scouts Report","Tifton, GATift County High School","WR","","NR","List"
"Karrington  AndrewsVideo | Scouts Report","Atlanta, GAWestlake High School","DT","","NR","List"
"Ronnie FloydVideo | Scouts Report","Saint Augustine, FLSaint Augustine High School","ILB","","NR","List"
"George CheeseboroughVideo | Scouts Report","Indianapolis, INWarren Central High School","RB","","NR","List"
"Nate  DreilingVideo | Scouts Report","Hutchinson, KSHutchinson Senior High School","OLB","","NR","List"
"Matt MoseVideo | Scouts Report","Denton, TXDenton High School","WR","","NR","List"
"David GraceVideo | Scouts Report","De Kalb, MSKemper County High School","WR","","NR","List"
"Tolu AkinwumiVideo | Scouts Report","Brampton, ONT, CANNotre Dame Catholic High School","S","","NR","Signed"
"Carson McKnightVideo | Scouts Report","Little Rock, ARPulaski Academy","WR","","NR","List"
"Andre CampbellVideo | Scouts Report","Steelton, PASteelton-Highspire High School","QB","","NR","List"
"Quaylon MoncriefVideo | Scouts Report","Prattville, ALPrattville High School","WR","","NR","List"
"Sam HomichVideo | Scouts Report","Vacaville, CAWill C. Wood High School","ILB","","NR","List"
"Deshon BestVideo | Scouts Report","Columbus, OHColumbus Africentric High School","WR","","NR","List"
"Mike PinciottiVideo | Scouts Report","Philadelphia, PASaint Joseph's Prep School","OG","","NR","List"
"Joel BitonioVideo | Scouts Report","Long Beach, CAWoodrow Wilson High School","OT","","NR","Signed"
"Sloan FrazzariVideo | Scouts Report","Anthem, AZBoulder Creek High School","DT","","NR","List"
"Russell CsonkaVideo | Scouts Report","Murrieta, CAMurrieta Valley High School","OC","","NR","List"
"Tom FultonVideo | Scouts Report","Pittsburgh, PAPenn Hills High School","QB","","NR","List"
"Lineten  BelizaireVideo | Scouts Report","Miami, FLMiami Northwestern High School","CB","","NR","List"
"Kenneth  LindseyVideo | Scouts Report","Sanford, NCSouthern Lee High School","ILB","","NR","List"
"Damion  SingletonVideo | Scouts Report","Vidalia, GAVidalia High School","FB","","NR","List"
"Corey SimpsonVideo | Scouts Report","Norwich, CTNorwich Free Academy","RB","","NR","List"
"Jameko MannsVideo | Scouts Report","Roanoke, VAPatrick Henry High School","OLB","","NR","List"
"Greg PalmerVideo | Scouts Report","Flowery Branch, GAFlowery Branch High School","S","","NR","List"
"C.J. StewardVideo | Scouts Report","Jacksonville, FLHargrave Military Academy","OLB(POST)","","NR","Signed"
"David  SperryVideo | Scouts Report","Las Vegas, NVFaith Lutheran High School","CB","","NR","Committed"
"Demitri DiamondVideo | Scouts Report","Newhall, CAWilliam S. Hart High School","WR","","NR","List"
"J.T. ZdanekVideo | Scouts Report","New Berlin, NYMilford Academy","CB(POST)","","NR","List"
"Anthony FerraroVideo | Scouts Report","Anaheim, CAServite High School","ATH","","NR","List"
"Jarel  MorrisVideo | Scouts Report","Atlanta, GAWestlake High School","RB","","NR","List"
"Vince D'AmatoVideo | Scouts Report","El Toro, CAEl Toro High School","K","","NR","Signed"
"Jordan HuntVideo | Scouts Report","Meadville, MSFranklin High School","ILB","","NR","List"
"Darius WessonVideo | Scouts Report","Windsor, NCBertie High School","WR","","NR","List"
"Martell MooreVideo | Scouts Report","San Antonio, TXEarl Warren High School","WR","","NR","Signed"
"Jordan PoyerVideo | Scouts Report","Astoria, ORAstoria High School","CB","","NR","Signed"
"Sage NuaVideo | Scouts Report","Henderson, NVLiberty High School","ILB","","NR","List"
"Derek RobinsonVideo | Scouts Report","Denver, COSouth High School","QB","","NR","List"
"Brandon  SlaterVideo | Scouts Report","Montgomery, ALRobert E. Lee High School","ILB","","NR","List"
"Levi  BrownVideo | Scouts Report","Bethlehem, PALiberty High School","DT","","NR","Signed"
"Jonathan GeorgeVideo | Scouts Report","Lincoln, ALLincoln High School","RB","","NR","Signed"
"Trace PawelekVideo | Scouts Report","Springtown, TXSpringtown High School","OLB","","NR","List"
"Forrest CookVideo | Scouts Report","Aledo, TXAledo High School","ATH","","NR","List"
"Joey IosefaVideo | Scouts Report","Fagaitua, American Samoa, SPFagaitua High School","ATH","","NR","Signed"
"Hakeem  VinsonVideo | Scouts Report","Four Oaks, NCSouth Johnston High School","DE","","NR","List"
"LeDarius OsborneVideo | Scouts Report","Nashville, TNMaplewood High School","OLB","","NR","List"
"Limebric WindhamVideo | Scouts Report","Irvington, ALAlma Bryant High School","WR","","NR","Committed"
"Cory HarrisonVideo | Scouts Report","Laurel, MSNortheast Jones High School","S","","NR","List"
"Lamar JohnsonVideo | Scouts Report","Pascagoula, MSPascagoula High School","S","","NR","List"
"Samuel Johnson IIIVideo | Scouts Report","Spotsylvania, VACourtland High School","DE","","NR","Signed01/07/2011"
"Brandon BatesVideo | Scouts Report","Columbia, SCA. C. Flora High School","OLB","","NR","List"
"Billy NagleVideo | Scouts Report","Venice, FLVenice High School","OT","","NR","List"
"Luke WischnowskiVideo | Scouts Report","Radnor, PAArchbishop Carroll High School","QB","","NR","List"
"Eric  WilliamsVideo | Scouts Report","Charlotte, NCMyers Park High School","CB","","NR","List"
"Chris  KobedaVideo | Scouts Report","Raleigh, NCLeesville Road High School","TE","","NR","List"
"Ryan MayVideo | Scouts Report","Milton, MAMilton Academy","ILB","","NR","List"
"Thomas  FriersonVideo | Scouts Report","Fayetteville, GAWhitewater High School","CB","","NR","List"
"Jeremiah  MillerVideo | Scouts Report","Walnut, CAMt. San Antonio College","DE","","NR","List"
"Troy SmithVideo | Scouts Report","Indianapolis, INPike High School","CB","","NR","Signed"
"Russell AllenVideo | Scouts Report","Saint Petersburg, FLGibbs High School","CB","","NR","List"
"John  BellVideo | Scouts Report","Concord, NCConcord High School","DT","","NR","List"
"Ralph GroverVideo | Scouts Report","Tampa, FLTampa Catholic High School","S","","NR","List"
"Dan  FisherVideo | Scouts Report","Harrisburg, PACentral Dauphin High School","K","","NR","List"
"Chauncey Winchester-MakainaiVideo | Scouts Report","Kailua, HIKailua High School","OG","","NR","List"
"Torrance MoiseVideo | Scouts Report","Sarasota, FLBooker T. Washington High School","QB","","NR","List"
"Vincent McDanielVideo | Scouts Report","Grand Prairie, TXSouth Grand Prairie High School","CB","","NR","List"
"Sharrod NarciseVideo | Scouts Report","Beaumont, TXMonsignor Kelly Catholic High School","WR","","NR","List"
"Paul HazelVideo | Scouts Report","Miami, FLSouth Miami High School","DE","","NR","Signed"
"Aulola TongaVideo | Scouts Report","Kahuku, HIKahuku High School","S","","NR","Signed"
"Deantre HarlanVideo | Scouts Report","Everman, TXEverman High School","ATH","","NR","Signed"
"Leon JacksonVideo | Scouts Report","Jacksonville, FLEd H. White High School","RB","","NR","Signed12/18/2010"
"Preston  YoungVideo | Scouts Report","Jacksboro, TNCampbell County High School","TE","","NR","List"
"David HindsVideo | Scouts Report","Miami, FLMiami Edison Senior High School","OLB","","NR","Signed"
"Forrest StuckyVideo | Scouts Report","Hutchinson, KSHutchinson Senior High School","DE","","NR","List"
"Scott DavidsonVideo | Scouts Report","Columbus, OHEastmoor High School","CB","","NR","List"
"Quincy McDuffieVideo | Scouts Report","Orlando, FLEdgewater High School","CB","","NR","Signed"
"Kyle RobiskieVideo | Scouts Report","Fort Lauderdale, FLCardinal Gibbons High School","WR","","NR","List"
"Courtland Styles Jr.Video | Scouts Report","Knoxville, TNKnoxville Catholic High School","WR","","NR","List"
"Tylur LengfeldVideo | Scouts Report","De Forest, WIDeForest High School","RB","","NR","List"
"Chris JessopVideo | Scouts Report","Ashburn, VABroad Run High School","CB","","NR","List"
"Charles  JohnsonVideo | Scouts Report","Baltimore, MDPolytechnic Institute High School","DE","","NR","List"
"James TaborVideo | Scouts Report","Fairport Harbor, OHHarding High School","OG","","NR","List"
"Jason BradyVideo | Scouts Report","McSherrystown, PADelone Catholic High School","OC","","NR","List"
"Chris PrideVideo | Scouts Report","Farmington Hills, MIHarrison High School","WR","","NR","List"
"Derek FrostVideo | Scouts Report","Columbia, SCRichland Northeast High School","QB","","NR","List"
"Dustin SmithVideo | Scouts Report","Woodland, WAWoodland High School","OG","","NR","List"
"Joe NagleVideo | Scouts Report","Newbury, OHNewbury High School","RB","","NR","List"
"Nicholas WoodsVideo | Scouts Report","Shawnee, KSMill Valley High School","RB","","NR","List"
"Pierce BurtonVideo | Scouts Report","Sacramento, CARio Americano High School","OT","","NR","Signed"
"Karl JamesVideo | Scouts Report","Miami, FLMiami Sunset High School","DE","","NR","Signed"
"Matt KowalisVideo | Scouts Report","Livonia, MIChurchill High School","RB","","NR","List"
"Jonathan CrawleyVideo | Scouts Report","Richmond, VAHuguenot High School","OT","","NR","List"
"Michael MillerVideo | Scouts Report","Houston, TXLamar Consolidated High School","OG","","NR","List"
"Jeremy McGaheeVideo | Scouts Report","Thomson, GAThomson High School","WR","","NR","List"
"Jakelton JoinerVideo | Scouts Report","Farmerville, LAFarmerville High School","OLB","","NR","List"
"Terry  SmithVideo | Scouts Report","Raleigh, NCSoutheast Raleigh High School","S","","NR","List"
"Jay BuchanonVideo | Scouts Report","Conroe, TXOak Ridge High School","S","","NR","List"
"Jarrod  GoodarzVideo | Scouts Report","Trenton, NJHamilton High School East","K","","NR","List"
"Evan NeffVideo | Scouts Report","Kettering, OHArchbishop Alter High School","OG","","NR","Signed"
"Jarrett FowlkesVideo | Scouts Report","Delavan, WIDelavan-Darien High School","WR","","NR","List"
"Darrell KingVideo | Scouts Report","Maywood, ILProviso East High School","WR","","NR","List"
"Jonathan SellersVideo | Scouts Report","Lithonia, GAMartin Luther King High School","S","","NR","List"
"Isaiah NewsomeVideo | Scouts Report","Petal, MSPetal High School","RB","","NR","Signed"
"Mark MulloyVideo | Scouts Report","Nashville, TNFather Ryan High School","OLB","","NR","List"
"Hussain TroweryVideo | Scouts Report","Reynoldsburg, OHReynoldsburg High School","S","","NR","List"
"Xavier MiltonVideo | Scouts Report","Alameda, CAEncinal High School","WR","","NR","List"
"Nate WareVideo | Scouts Report","Visalia, CAEl Diamante High School","S","","NR","List"
"Omar DroubiVideo | Scouts Report","Bloomfield Hills, MIAndover High School","ILB","","NR","List"
"Lamar McLendonVideo | Scouts Report","Fayetteville, NCSeventy-First Senior High School","OLB","","NR","Signed"
"Mohammed SeisayVideo | Scouts Report","Springfield, VAFork Union Military Academy","S(POST)","","NR","Signed"
"Michael RatterreeVideo | Scouts Report","Houston, TXMemorial High School","S","","NR","List"
"Tekena OmoegbekuseVideo | Scouts Report","Worcester, MADoherty Memorial High School","RB","","NR","List"
"Will MiddletonVideo | Scouts Report","Marietta, GAKell High School","TE","","NR","List"
"Josh HamblinVideo | Scouts Report","East Orem, UTOrem High School","QB","","NR","List"
"Kenneth AgeeVideo | Scouts Report","Shaker Heights, OHShaker Heights High School","DE","","NR","List"
"Devon StewartVideo | Scouts Report","Winter Haven, FLWinter Haven High School","TE","","NR","List"
"Kyle  SirlVideo | Scouts Report","Lodi, OHCloverleaf High School","DE","","NR","List"
"Jimmie BushVideo | Scouts Report","Saint Petersburg, FLSaint Petersburg High School","OG","","NR","List"
"Michael GarrettVideo | Scouts Report","Arlington, TXArlington High School","RB","","NR","List"
"Will AtterberryVideo | Scouts Report","Lewisville, TXLewisville High School","K","","NR","Signed"
"Charles ScottVideo | Scouts Report","Fort Washington, MDFriendly Senior High School","OLB","","NR","List"
"Quinton PoolerVideo | Scouts Report","Dublin, GADublin High School","OLB","","NR","List"
"Marcus GreenVideo | Scouts Report","Scotch Plains, NJScotch Plains-Fanwood High School","ILB","","NR","Signed"
"Ronnie  SmithVideo | Scouts Report","Suwanee, GAPeachtree Ridge High School","RB","","NR","List"
"Luidj MichelVideo | Scouts Report","Homestead, FLHomestead Senior High School","DE","","NR","List"
"Michael BurnsVideo | Scouts Report","Wilkes-Barre, PAHargrave Military Academy","CB(POST)","","NR","List"
"Dejon  HarrisVideo | Scouts Report","Durham, NCCharles E. Jordan Senior H. S.","DT","","NR","List"
"Dharhan MasonVideo | Scouts Report","Lexington, KYBryan Station High School","OLB","","NR","List"
"Jamil ThorneVideo | Scouts Report","Colorado Springs, CORoy J. Wasson High School","WR","","NR","List"
"Jeremy  LewisVideo | Scouts Report","Prichard, ALVigor High School","WR","","NR","List"
"Seth StockettVideo | Scouts Report","Fort Smith, ARSouthside Senior High School","WR","","NR","List"
"John RappVideo | Scouts Report","Manassas, VAOsbourn Senior High School","ILB","","NR","List"
"Jared VerutoVideo | Scouts Report","Endicott, NYUnion-Endicott Central School","DT","","NR","List"
"Zack McKownVideo | Scouts Report","Salt Lake City, UTJudge Memorial Catholic High School","OLB","","NR","List"
"Matt ReillyVideo | Scouts Report","Grand Rapids, MIEast Grand Rapids High School","OT","","NR","List"
"Quaylon EwingVideo | Scouts Report","Sugar Land, TXKempner High School","CB","","NR","Signed"
"Percival JamesVideo | Scouts Report","Delray Beach, FLAtlantic Community High School","DT","","NR","List"
"Darius TaylorVideo | Scouts Report","Mesquite, TXMesquite High School","ILB","","NR","List"
"Gary DemusVideo | Scouts Report","Lexington, KYLafayette High School","S","","NR","List"
"Robert LewisVideo | Scouts Report","Mesquite, TXMesquite High School","OLB","","NR","List"
"Brian SchwVideo | Scouts Report","Billings, MTBillings West High School","QB","","NR","List"
"William RichardVideo | Scouts Report","Millbrook, ALStanhope Elmore High School","ILB","","NR","List"
"Ryan AveryVideo | Scouts Report","Kaysville, UTDavis High School","WR","","NR","List"
"Taylor JohnstoneVideo | Scouts Report","Douglasville, GAChapel Hill High School","OT","","NR","List"
"Kyle NicholVideo | Scouts Report","Lowell, MILowell High School","QB","","NR","List"
"Dominique WareVideo | Scouts Report","Plainfield, ILPlainfield South High School","CB","","NR","Signed"
"Marquis MillerVideo | Scouts Report","North Chicago, ILNorth Chicago Community High School","WR","","NR","List"
"Jared HestonVideo | Scouts Report","Coeur D'Alene, IDLake City High School","ILB","","NR","Signed"
"Bernard DawsonVideo | Scouts Report","Jacksonville, FLAndrew Jackson High School","OLB","","NR","List"
"Michael GrahamVideo | Scouts Report","Charlottesville, VAMonticello High School","QB","","NR","List"
"Will  CalviVideo | Scouts Report","Blairstown, NJBlair Academy","DE","","NR","List"
"Marchez PattersonVideo | Scouts Report","River Ridge, LAJohn Curtis Christian High School","RB","","NR","List"
"Travis CroweVideo | Scouts Report","Leslie, MILeslie High School","QB","","NR","List"
"Caleb MasseyVideo | Scouts Report","Sulligent, ALSulligent High School","S","","NR","Signed"
"Justin  JohnsonVideo | Scouts Report","Chipley, FLChipley High School","DE","","NR","List"
"Devin PaulsenVideo | Scouts Report","Lincoln, NELincoln Christian High School","OLB","","NR","List"
"Cody MatthewsVideo | Scouts Report","Spring Branch, TXSmithson Valley High School","WR","","NR","List"
"Marquise O'NealVideo | Scouts Report","Woodbridge, VAForest Park High School","DT","","NR","List"
"Cody  PopeVideo | Scouts Report","Hoxie, KSHoxie High School","ATH","","NR","List"
"Blake GrahamVideo | Scouts Report","Philadelphia, PANortheast Catholic High School","OT","","NR","List"
"Brandon WashingtonVideo | Scouts Report","Napa, CANapa High School","WR","","NR","List"
"Judd EdwardsVideo | Scouts Report","Oxford, ALOxford High School","QB","","NR","List"
"Ryan AttawayVideo | Scouts Report","Kingsland, GACamden County High School","OT","","NR","Signed"
"Ryan KirkleyVideo | Scouts Report","Coppell, TXCoppell High School","S","","NR","List"
"Patrick  DurrVideo | Scouts Report","Brandon, MSBrandon High School","RB","","NR","List"
"Jordan ClentimddackVideo | Scouts Report","Lebanon, PALebanon High School","WR","","NR","List"
"Brandon HaskinsVideo | Scouts Report","Baton Rouge, LADesire Street Academy","OT","","NR","List"
"Daniel SmithVideo | Scouts Report","Little River, SCNorth Myrtle Beach High School","QB","","NR","List"
"Caleb LucasVideo | Scouts Report","Four Oaks, NCSouth Johnston High School","CB","","NR","Committed"
"Christopher LabouffVideo | Scouts Report","Los Gatos, CALos Gatos High School","RB","","NR","List"
