"Name","Hometown","Position","Stars","Grade","School"
"Wesner Pierre-LouisVideo | Scouts Report","Miami, FLMiami Northwestern High School","OG","","NR","List"
"Ryan  LandseadelVideo | Scouts Report","Westlake Village, CAOaks Christian High School","CB","","NR","List"
"Andre FinnieVideo | Scouts Report","Miami, FLMiami Northwestern High School","WR","","NR","List"
"Paul PiukalaVideo | Scouts Report","Oakland, CACastlemont High School","DE","","NR","List"
"Frederick GuerinVideo | Scouts Report","Baton Rouge, LASouthern University Lab","CB","","NR","List"
"Dan CurryVideo | Scouts Report","Johnstown, PAWestmont Hilltop High School","OT","","NR","List"
"Dontae BrownVideo | Scouts Report","Pittsburgh, PAPenn Hills High School","WR","","NR","List"
"Kenneth JenkinsVideo | Scouts Report","Galveston, TXBall High School","CB","","NR","List"
"Terron FreemanVideo | Scouts Report","Southaven, MSSouthaven High School","WR","","NR","List"
"Trevor RothsteinVideo | Scouts Report","Lemont, ILLemont High School","OG","","NR","List"
"Charles WatkinsVideo | Scouts Report","Camden, NJCamden High School","WR","","NR","List"
"Cole LailVideo | Scouts Report","Alcoa, TNWilliam Blount High School","ILB","","NR","List"
"Dan SpragueVideo | Scouts Report","Columbus, OHWorthington Kilbourne High School","DT","","NR","Signed"
"Pete KontodiakosVideo | Scouts Report","Clearwater, FLCountryside High School","K","","NR","Signed"
"Bill NesseltVideo | Scouts Report","Fort Lauderdale, FLSaint Thomas Aquinas High School","DE","","NR","Signed12/18/2010"
"Kris YeatsVideo | Scouts Report","Newnan, GANewnan High School","WR","","NR","List"
"Kenry TolbertVideo | Scouts Report","Birmingham, ALA. H. Parker High School","ILB","","NR","List"
"Conner St. ClairVideo | Scouts Report","Laguna Niguel, CADana Hills High School","S","","NR","List"
"Jeff ButlerVideo | Scouts Report","Los Gatos, CALos Gatos High School","QB","","NR","List"
"Phil  GalaskaVideo | Scouts Report","Strongsville, OHStrongsville High School","DE","","NR","List"
"Hakeem WorthenVideo | Scouts Report","Knoxville, TNSouth Doyle High School","DT","","NR","List"
"Ocie McElhaneyVideo | Scouts Report","Gastonia, NCAshbrook High School","RB","","NR","List"
"Bruno RylesVideo | Scouts Report","Columbus, GACarver High School","ILB","","NR","List"
"Toma JeremiahVideo | Scouts Report","Sacramento, CAGrant High School","ILB","","NR","Signed"
"Keandreas  WynnVideo | Scouts Report","Newnan, GANewnan High School","RB","","NR","List"
"Javontay CroweVideo | Scouts Report","Ruston, LARuston High School","S","","NR","Signed"
"Brady AttawayVideo | Scouts Report","Whitehouse, TXWhitehouse High School","QB","","NR","Signed01/07/2011"
"Marquise  CoxVideo | Scouts Report","Riverside, CAJohn W. North High School","CB","","NR","List"
"Derek  MarreroVideo | Scouts Report","Miami, FLDade Christian High School","ILB","","NR","List"
"Dillon GoltlVideo | Scouts Report","McCook, NEMcCook High School","WR","","NR","List"
"Corey ReeceVideo | Scouts Report","Floyds Knobs, INFloyd Central High School","OG","","NR","List"
"Raquan DurranteVideo | Scouts Report","Fort Campbell, KYFort Campbell High School","CB","","NR","List"
"Steven JenkinsVideo | Scouts Report","Pensacola, FLPine Forest High School","OLB","","NR","List"
"James laugVideo | Scouts Report","Tacoma, WAWashington High School","OG","","NR","Signed12/18/2010"
"Justin VeltungVideo | Scouts Report","Puyallup, WAPuyallup High School","WR","","NR","Signed"
"Aaron  MatthewsVideo | Scouts Report","McKinney, TXMcKinney North High School","TE","","NR","List"
"Brandon BradfordVideo | Scouts Report","Novi, MINovi High School","WR","","NR","List"
"Dominic FerrellVideo | Scouts Report","Oakland, CAOakland High School","RB","","NR","List"
"Jordan HigginsVideo | Scouts Report","Mendon, MIMendon Community High School","RB","","NR","List"
"Quartez CarterVideo | Scouts Report","Spotsylvania, VASpotsylvania High School","DE","","NR","List"
"Chris LovelessVideo | Scouts Report","South Houston, TXSouth Houston High School","OLB","","NR","List"
"Marcus DixonVideo | Scouts Report","Stamford, CTStamford High School","RB","","NR","Committed"
"Brendan  MochorukVideo | Scouts Report","East Grand Forks, MNEast Grand Forks Senior High","TE","","NR","List"
"Lyle NegronVideo | Scouts Report","Murrieta, CAMurrieta Valley High School","QB","","NR","List"
"Bernard PierceVideo | Scouts Report","Concordville, PAGlen Mills School","RB","","NR","Signed"
"Andrell SmithVideo | Scouts Report","Palmetto, FLPalmetto High School","WR(LQ)","","NR","Signed"
"Matt FedorVideo | Scouts Report","Pittsburgh, PASeton-La Salle High School","OC","","NR","List"
"Will ColemanVideo | Scouts Report","West Helena, ARDe Soto High School","QB","","NR","List"
"Allen  EgglestonVideo | Scouts Report","Lewis Center, OHOlentangy High School","RB","","NR","List"
"Tobi SaporuVideo | Scouts Report","Blaine, MNBlaine High School","ILB","","NR","List"
"Kendrick DentVideo | Scouts Report","Mobile, ALLeFlore Magnet High School","QB","","NR","List"
"J.B. DockVideo | Scouts Report","Ventura, CASaint Bonaventure High School","CB","","NR","Signed"
"Carl  WadeVideo | Scouts Report","Wilmington, DEHoward High School Of Technology","RB","","NR","List"
"Jarred WilliamsVideo | Scouts Report","Fort Walton Beach, FLFort Walton Beach High School","DE","","NR","Signed"
"Jordan Pu'u RobinsonVideo | Scouts Report","Wailuku, HIBaldwin High School","DE","","NR","Signed"
"Blake  MatherneVideo | Scouts Report","Belle Chasse, LABelle Chasse High School","ATH","","NR","List"
"Devin WorthingtonVideo | Scouts Report","Rochester, NYAquinas Institute","S","","NR","List"
"Brandon HoverVideo | Scouts Report","Tallahassee, FLGodby High School","RB","","NR","List"
"Patrick O'DonnellVideo | Scouts Report","Lake Worth, FLPalm Beach Central High School","K","","NR","Signed"
"Bob  RoyalVideo | Scouts Report","Springfield, PACardinal O'Hara High School","WR","","NR","List"
"Kyle GillamVideo | Scouts Report","Lumberton, TXLumberton High School","OC","","NR","Committed"
"Jadareius HamlinVideo | Scouts Report","Forsyth, GAMary Persons High School","OG","","NR","Signed"
"Bo CordellVideo | Scouts Report","Cincinnati, OHIndian Hill High School","QB","","NR","List"
"Cameron CoonVideo | Scouts Report","Pleasanton, CAFoothill High School","QB","","NR","List"
"Chris BerangerVideo | Scouts Report","Winthrop, MAWinthrop High School","S","","NR","Signed12/18/2010"
"Ronald  FlowersVideo | Scouts Report","Kingsland, GACamden County High School","RB","","NR","List"
"Paulo HenriquesVideo | Scouts Report","West Memphis, ARWest Memphis High School","K","","NR","Signed"
"Tommy PapilionVideo | Scouts Report","Aurora, COCherry Creek High School","WR","","NR","List"
"Ethan WinsteadVideo | Scouts Report","Detroit, MICrockett Technical High School","WR","","NR","List"
"Brenton BeirneVideo | Scouts Report","Honolulu, HIMid-Pacific Insitute","QB","","NR","List"
"Tommy BouthillierVideo | Scouts Report","Reno, NVBishop Manogue High School","OC","","NR","List"
"Tramaine StringfellowVideo | Scouts Report","Atlanta, GAWestlake High School","OLB","","NR","List"
"Anquan ClemonsVideo | Scouts Report","Grand Blanc, MIGrand Blanc High School","CB","","NR","List"
"Tyler BittnerVideo | Scouts Report","Franklin, PAFranklin High School","WR","","NR","List"
"David  McIntyreVideo | Scouts Report","Winston-Salem, NCCarver High School","CB","","NR","List"
"David RenfroeVideo | Scouts Report","Batesville, MSSouth Panola High School","QB","","NR","List"
"Josh KaiwiVideo | Scouts Report","Anchorage, AKWest Anchorage High School","DE","","NR","Signed"
"Ryan RomeVideo | Scouts Report","Destrehan, LADestrehan High School","K","","NR","Signed"
"Trent ThomasVideo | Scouts Report","Brenham, TXBrenham High School","S","","NR","Signed"
"Matt KellyVideo | Scouts Report","Maiden, NCMaiden High School","K","","NR","List"
"Matthew BensonVideo | Scouts Report","Traverse City, MISaint Francis High School","TE","","NR","List"
"Quintin  McKenzieVideo | Scouts Report","Cleveland Heights, OHLutheran High School East","RB","","NR","List"
"Kenton  RowlandVideo | Scouts Report","Raleigh, NCSoutheast Raleigh High School","DE","","NR","List"
"Alex WalkerVideo | Scouts Report","Great Falls, VAHargrave Military Academy","DT(POST)","","NR","List"
"Josh CloverVideo | Scouts Report","Miami, FLMiami Central High School","QB","","NR","List"
"Frank MintonVideo | Scouts Report","Lakewood, FLSaint Petersburg High School","CB","","NR","List"
"Mytez MaddenVideo | Scouts Report","Anniston, ALSaks High School","OLB","","NR","List"
"Cordell RobinsonVideo | Scouts Report","Jefferson, TXJefferson High School","WR","","NR","Signed01/07/2011"
"Cody  RosierVideo | Scouts Report","Buffalo, MOBuffalo High School","DE","","NR","List"
"Jeremy CraytonVideo | Scouts Report","Piscataway, NJPiscataway High School","WR","","NR","List"
"Matthew SmithVideo | Scouts Report","Haughton, LAHaughton High School","QB","","NR","List"
"Jibrille FewellVideo | Scouts Report","Rock Hill, SCSouth Pointe High School","DT","","NR","Signed"
"Adam WhiteVideo | Scouts Report","Somerset, KYSouthwestern-Pulaski High School","WR","","NR","List"
"Trenere JohnsonVideo | Scouts Report","Daphne, ALDaphne High School","WR","","NR","List"
"Harrison  GoreVideo | Scouts Report","Macon, GATattnall Square Academy","ILB","","NR","List"
"Adam SteinerVideo | Scouts Report","Canton, OHGlenOak High School","ATH","","NR","Signed"
"Vernon RogersVideo | Scouts Report","Houston, TXKlein Forest High School","WR","","NR","List"
"Will HolderVideo | Scouts Report","Palo Alto, CAPalo Alto High School","S","","NR","List"
"Michael  StreeterVideo | Scouts Report","Washington, DCArchbishop Carroll High School","ATH","","NR","List"
"Jordan AndersonVideo | Scouts Report","Chantilly, VAWestfield High School","RB","","NR","Signed01/07/2011"
"Lorenzo Profit Jr.Video | Scouts Report","Miami, FLMiami Central High School","CB","","NR","List"
"Jaycob ShoemakerVideo | Scouts Report","Orangevale, CACasa Roble High School","ILB","","NR","Committed"
"Antonio JordanVideo | Scouts Report","Evergreen, ALHillcrest High School","DT","","NR","List"
"Michael BeatonVideo | Scouts Report","Dallas, ORDallas High School","OG","","NR","Signed"
"Paul  IglarVideo | Scouts Report","Appleton, WIXavier High School","K","","NR","List"
"Brett CraineVideo | Scouts Report","Pine Bluff, ARWhite Hall High School","DT","","NR","List"
"Antron HarrisVideo | Scouts Report","Navasota, TXNavasota High School","WR","","NR","List"
"Dominique AribaldVideo | Scouts Report","Jacksonville, FLWolfson High School","CB","","NR","List"
"Tyler ThomasVideo | Scouts Report","Kalispell, MTFlathead High School","OG","","NR","Signed"
"Denario GrayVideo | Scouts Report","Warrensville Heights, OHWarrensville Heights High School","WR","","NR","List"
"Kasim EdebaliVideo | Scouts Report","Meriden, NHKimball Union Academy","DE","","NR","Signed"
"Brett DavisVideo | Scouts Report","Shawnee, OKShawnee High School","WR","","NR","Signed"
"Quincy  ChapmanVideo | Scouts Report","Winchester, TNFranklin County High School","CB","","NR","List"
"Dwayne HarbisonVideo | Scouts Report","Charlotte, NCMallard Creek High School","OC","","NR","List"
"Airieus ErvinVideo | Scouts Report","Lawton, OKLawton High School","OLB","","NR","List"
"Ford KirklandVideo | Scouts Report","Tallahassee, FLNorth Florida Christian High School","CB","","NR","List"
"Zach MorganVideo | Scouts Report","Lake Charles, LASam Houston High School","OG","","NR","Signed"
"Preston KingVideo | Scouts Report","Las Flores, CATesoro High School","WR","","NR","Signed"
"Keensen ChambersVideo | Scouts Report","Greenville, SCWorcester Academy","DE(POST)","","NR","Signed"
"Juwaun FanninVideo | Scouts Report","Jacksonville, FLPotters House Christian","DT","","NR","List"
"Jamal DavisVideo | Scouts Report","Coral Springs, FLCoral Springs Chistian Academy","WR","","NR","Signed"
"Kyle WhiteVideo | Scouts Report","New Orleans, LAMcDonogh 35 High School","DT","","NR","Signed"
"Tavita KinikiniVideo | Scouts Report","Salt Lake City, UTHighland High School","FB","","NR","List"
"Josh CampionVideo | Scouts Report","Fergus Falls, MNFergus Falls High School","OT","","NR","Signed"
"Brandon BoydVideo | Scouts Report","Aldine, TXDwight D. Eisenhower High School","S","","NR","List"
"Kyle  JonesVideo | Scouts Report","Mobile, ALMcGill-Toolen Catholic High School","ATH","","NR","List"
"Aaron TangumaVideo | Scouts Report","Edcouch, TXEdcouch Elsa High School","TE","","NR","Signed"
"Emir LopezVideo | Scouts Report","Las Vegas, NVLas Vegas High School","QB","","NR","List"
"Artavious DowdellVideo | Scouts Report","Belle Glade, FLGlades Central High School","DE","","NR","List"
"Rafig WallaceVideo | Scouts Report","South Huntington, NYSaint Anthony's High School","OLB","","NR","List"
"Neil  CrumptonVideo | Scouts Report","Houston, TXSt. Pius X High School","DT","","NR","List"
"Jermaine VereenVideo | Scouts Report","Conway, SCConway High School","CB","","NR","Signed"
"Beadley WallaceVideo | Scouts Report","Palm Beach Gardens, FLPalm Beach Gardens High School","ATH","","NR","List"
"Terrell MalleyVideo | Scouts Report","Portland, ORRoosevelt High School","WR","","NR","List"
"Michael LeaksVideo | Scouts Report","Winnsboro, TXWinnsboro High School","DE","","NR","Signed01/07/2011"
"Brian BrooksVideo | Scouts Report","Fort Washington, MDFriendly Senior High School","OLB","","NR","List"
"Dae'Quan ScottVideo | Scouts Report","Springfield, VARobert E. Lee High School","ATH","","NR","Signed01/07/2011"
"Dan  Van NortonVideo | Scouts Report","Berwyn, PAConestoga High School","OLB","","NR","List"
"Jamaal  SampsonVideo | Scouts Report","Dade City, FLPasco High School","CB","","NR","List"
"Mark HaskellVideo | Scouts Report","Encino, CACrespi Carmelite High School","OLB","","NR","List"
"Connor OrrVideo | Scouts Report","Suwanee, GAPeachtree Ridge High School","TE","","NR","List"
"Brandon HazzardVideo | Scouts Report","Dublin, VAPulaski County High School","OLB","","NR","List"
"Rockey VannVideo | Scouts Report","Ocoee, FLOcoee High School","WR","","NR","Signed"
"Mike GreenVideo | Scouts Report","Saginaw, MISaginaw High School","WR","","NR","List"
"Nick RomeVideo | Scouts Report","Ruston, LARuston High School","QB","","NR","List"
"Drake FurciniVideo | Scouts Report","Redmond, WAEastlake High School","QB","","NR","List"
"Lonnie  MooreVideo | Scouts Report","Augusta, GAGlenn Hills High School","ILB","","NR","List"
"Justin  FermanVideo | Scouts Report","Apache Junction, AZApache Junction High School","ILB","","NR","List"
"DeAndre StewartVideo | Scouts Report","Houston, TXNorth Forest High School","S","","NR","Signed"
"Tim DondanvilleVideo | Scouts Report","Springfield, ILSacred Heart-Griffin High School","QB","","NR","List"
"Joshua ReedVideo | Scouts Report","Hammond, LASaint Thomas Aquinas High School","RB","","NR","List"
"Brandon  KillebrewVideo | Scouts Report","Springdale, MDC. H. Flowers High School","ILB","","NR","Committed"
"Darious GreenVideo | Scouts Report","Fredericksburg, VAMassaponax High School","WR","","NR","List"
"Eric AderetiVideo | Scouts Report","Irondale, ALShades Valley High School","ATH","","NR","List"
"Jon BillupsVideo | Scouts Report","Picayune, MSPicayune Memorial High School","OG","","NR","List"
"LaRon KelleyVideo | Scouts Report","Plano, TXPlano Senior High School","CB","","NR","List"
"Rodney  CofieldVideo | Scouts Report","Atlanta, GABooker T. Washington High School","RB","","NR","List"
"Joseph FigueroaVideo | Scouts Report","Fuquay-Varina, NCFuquay-Varina Senior High School","OG","","NR","List"
"Kyle  TudorVideo | Scouts Report","Evans, GALakeside High School","OLB","","NR","Signed"
"Jason PinkstonVideo | Scouts Report","Cleveland, OHGlenville High School","CB","","NR","Signed"
"Joe BrunetVideo | Scouts Report","Loomis, CADel Oro High School","ILB","","NR","List"
"Craig RobinsonVideo | Scouts Report","Hayti, MOHayti Senior High School","DT","","NR","List"
"Ben CrumptonVideo | Scouts Report","Hot Springs, ARLakeside High School","WR","","NR","List"
"Corbin DickersonVideo | Scouts Report","Altus, OKAltus High School","OLB","","NR","List"
"Darius TravickVideo | Scouts Report","Columbus, GAShaw High School","OT","","NR","List"
"Carl GibsonVideo | Scouts Report","Honolulu, HIIolani School","OLB","","NR","List"
"Jarius CampbellVideo | Scouts Report","Pickerington, OHPickerington North High School","DE","","NR","Signed"
"B.J. RayVideo | Scouts Report","Waynesville, MOWaynesville High School","S","","NR","List"
"Teron DavisVideo | Scouts Report","Charlotte, NCMallard Creek High School","S","","NR","List"
"Spencer GroomsVideo | Scouts Report","Cosby, TNCosby High School","TE","","NR","List"
"Carlan  BowmanVideo | Scouts Report","Rossville, GARidgeland High School","ATH","","NR","List"
"Darius RobinsonVideo | Scouts Report","Dallas, TXSouth Oak Cliff High","OG","","NR","List"
"Dustin SpringerVideo | Scouts Report","Birmingham, ALJohn Carroll Catholic High School","OT","","NR","List"
"Isaiah GloverVideo | Scouts Report","Cuero, TXCuero High School","CB","","NR","List"
"Chris McNeillVideo | Scouts Report","Sherman Oaks, CANotre Dame High School","WR","","NR","Signed"
"Troy GodfreyVideo | Scouts Report","Eunice, LAEunice High School","S","","NR","List"
"Taylor BrothwellVideo | Scouts Report","Marion, MIMarion High School","OG","","NR","Committed"
"Jordan DavisVideo | Scouts Report","Fort Walton Beach, FLChoctawhatchee High School","DT","","NR","Signed"
"Brad HeldtVideo | Scouts Report","Omaha, NECreighton Prep High School","S","","NR","List"
"William FordVideo | Scouts Report","Snellville, GASouth Gwinnett High School","ATH","","NR","List"
"Thomas JacksonVideo | Scouts Report","Prairieville, LAHargrave Military Academy","WR(POST)","","NR","List"
"Kelby DiasVideo | Scouts Report","Colorado Springs, COSierra High School","WR","","NR","List"
"Nick OrchardVideo | Scouts Report","Salt Lake City, UTHighland High School","CB","","NR","List"
"Cole StanfordVideo | Scouts Report","Grass Valley, CANevada Union High School","CB","","NR","List"
"Kewante DewberryVideo | Scouts Report","Oklahoma City, OKMillwood High School","RB","","NR","List"
"Jorge YoungVideo | Scouts Report","Bridgeville, DEWoodbridge Jr.-Sr. High School","DT","","NR","List"
"Paul EnaVideo | Scouts Report","Kenmore, WAInglemoor High School","OLB","","NR","Signed12/18/2010"
"Vincent HarperVideo | Scouts Report","Belle Glade, FLGlades Central High School","OG","","NR","List"
"Aric  DanielsVideo | Scouts Report","Mequon, WIHomestead High School","RB","","NR","List"
"C.J. BroadesVideo | Scouts Report","Texarkana, TXPleasant Grove High School","WR","","NR","Signed"
"Randy  BullockVideo | Scouts Report","Klein, TXKlein High School","K","","NR","List"
"Nathan HarrisonVideo | Scouts Report","Fresno, CAEdison High School","DE","","NR","Signed"
"Jonathan GazailleVideo | Scouts Report","Arlington, TXJames Bowie High School","WR","","NR","List"
"Sean UnterkoeflerVideo | Scouts Report","Reading, PAExeter Township High School","RB","","NR","Signed12/18/2010"
"Chad DubielVideo | Scouts Report","Cicero, NYCicero-North Syracuse High","S","","NR","List"
"Demil DavisVideo | Scouts Report","Atlanta, GABooker T. Washington High School","OLB","","NR","List"
"Matt MusgraveVideo | Scouts Report","Fort Collins, CORocky Mountain High School","ILB","","NR","List"
"Ja'Kar BridgesVideo | Scouts Report","Buford, GABuford High School","WR","","NR","List"
"Dri ArcherVideo | Scouts Report","Laurel, FLVenice High School","RB","","NR","Signed"
"Jaron TurnerVideo | Scouts Report","Killeen, TXEllison High School","WR","","NR","List"
"Dylan HughesVideo | Scouts Report","Fayetteville, NCPine Forest High School","DT","","NR","List"
"Alex DunhamVideo | Scouts Report","Friona, TXFriona High School","OG","","NR","List"
"Evan HeardVideo | Scouts Report","West Covina, CASouth Hills High School","RB","","NR","List"
"J.R. KabbaVideo | Scouts Report","Batavia, ILBatavia High School","RB","","NR","List"
"Marquise DiamondVideo | Scouts Report","Piedmont, ALPiedmont High School","WR","","NR","List"
"Greg SmithVideo | Scouts Report","Perris, CACitrus Hill High School","ATH","","NR","Signed"
"Renard RobinsonVideo | Scouts Report","Baltimore, MDMount St. Joseph High School","ATH","","NR","Signed01/07/2011"
"Andy StallingsVideo | Scouts Report","Springfield, VAWest Springfield High School","WR","","NR","List"
"Matt LancasterVideo | Scouts Report","West Lafayette, INWest Lafayette High School","QB","","NR","Committed"
"Johnny RoundtreeVideo | Scouts Report","Saint Petersburg, FLGibbs High School","CB","","NR","List"
"Robert RossVideo | Scouts Report","Bay Springs, MSBay Springs High School","WR","","NR","List"
"Jordan MillerVideo | Scouts Report","Kennesaw, GAHarrison High School","OT","","NR","Signed"
"Skylar BarrentineVideo | Scouts Report","Lake Charles, LASam Houston High School","WR","","NR","List"
"Nathan JolleyVideo | Scouts Report","Germantown, TNHouston High School","QB","","NR","List"
"Luke BublitzVideo | Scouts Report","Thornton, COLegacy High School","QB","","NR","List"
"Gavin EscobarVideo | Scouts Report","Rancho Santa Margarita, CASanta Margarita Catholic High School","WR","","NR","Signed"
"Terhon  O'NealVideo | Scouts Report","Westlake Village, CAWestlake High School","CB","","NR","List"
"Sklyer TitusVideo | Scouts Report","Nappanee, INNorthwood High School","QB","","NR","List"
"Jerrell  RobinsonVideo | Scouts Report","Irvington, NJIrvington High School","DT","","NR","List"
"Kiante YoungVideo | Scouts Report","Gainesville, GAEast Hall High School","ATH","","NR","Signed"
"Nickolus ThomasVideo | Scouts Report","Memphis, TNFrayser High School","WR","","NR","List"
"Chevy BennettVideo | Scouts Report","Sachse, TXSachse High School","S","","NR","Signed"
"Lamance  DesirVideo | Scouts Report","Miami, FLMiami Central High School","DT","","NR","List"
"Bradley TerryVideo | Scouts Report","Lancaster, PAManheim Township High School","OLB","","NR","List"
"Nicholas PrimaveraVideo | Scouts Report","Hilliard, OHDarby High School","DE","","NR","List"
"Tyshon GoodeVideo | Scouts Report","Syracuse, NYHargrave Military Academy","ATH(POST)","","NR","Signed"
"Alex HansonVideo | Scouts Report","Burien, WAJohn F. Kennedy High School","OT","","NR","List"
"Terrell BradleyVideo | Scouts Report","Gainesville, FLEastside High School","CB","","NR","Signed"
"Justin McCrearyVideo | Scouts Report","Theodore, ALTheodore High School","FB","","NR","List"
"Josh RobersonVideo | Scouts Report","Detroit, MIEast Detroit High School","OG","","NR","List"
"J.J. MartinVideo | Scouts Report","White Hall, ARWhite Hall High School","WR","","NR","List"
"Kelso WilkinsVideo | Scouts Report","Everett, WAArchbishop Murphy High School","CB","","NR","List"
"Loren PowersVideo | Scouts Report","Ventura, CASaint Bonaventure High School","OLB","","NR","List"
"J.R. ReficeVideo | Scouts Report","Archbald, PAValley View High School","DT","","NR","List"
"Vilbert  Green Video | Scouts Report","Miami, FLMiami Northwestern High School","ATH","","NR","List"
"David  WilliamsVideo | Scouts Report","Chester, VAThomas Dale High School","CB","","NR","Committed"
"Chris QuinnVideo | Scouts Report","Miami, FLSouthwest Miami Senior High School","CB","","NR","Signed"
"Seth GilkeyVideo | Scouts Report","Palestine, TXWestwood High School","OLB","","NR","List"
"Brandon SchroederVideo | Scouts Report","Canonsburg, PACanon McMillan High School","WR","","NR","List"
"Demarcus  BuffordVideo | Scouts Report","Rosenberg, TXTerry High School","RB","","NR","List"
"William  CaudleVideo | Scouts Report","Huntsville, ALWestminster Christian Academy","WR","","NR","List"
"Chris FerrittoVideo | Scouts Report","Daytona Beach, FLSeabreeze Senior High School","ILB","","NR","List"
"Jacob  TrahanVideo | Scouts Report","Jennings, LAJennings High School","DT","","NR","List"
"Sammuel TreatVideo | Scouts Report","Mesa, AZDesert Ridge High School","WR","","NR","List"
"Antonio MarshallVideo | Scouts Report","Rochelle, GAWilcox County High School","S","","NR","List"
"Luke ConnellVideo | Scouts Report","Statesboro, GAStatesboro High School","QB","","NR","List"
"LaMarc StrahanVideo | Scouts Report","Humble, TXHumble High School","DT","","NR","List"
"Bradley BrownVideo | Scouts Report","Baton Rouge, LACapitol Senior High School","WR","","NR","List"
"K.C. LoganVideo | Scouts Report","Tuscaloosa, ALTuscaloosa Central High School","FB","","NR","List"
"Nick CooperVideo | Scouts Report","Lexington, KSBryan Station High School","DT","","NR","List"
"Shane WilkinsonVideo | Scouts Report","El Paso, TXCoronado High School","WR","","NR","List"
"Josh NortonVideo | Scouts Report","Norman, OKNorman North High School","WR","","NR","List"
"Robert  LisowskiVideo | Scouts Report","Union, NJUnion High School","DE","","NR","List"
"Ryan Randolph-ColburnVideo | Scouts Report","Kentwood, MIEast Kentwood High School","WR","","NR","List"
"Blake HeimanVideo | Scouts Report","White Lake, MILakeland High School","QB","","NR","List"
"Miles GamageVideo | Scouts Report","Las Vegas, NVSierra Vista High School","DT","","NR","List"
"JaVon WilliamsVideo | Scouts Report","Olathe, KSOlathe East High School","RB","","NR","List"
"Jonathan MeltonVideo | Scouts Report","Pensacola, FLPensacola Catholic High School","OLB","","NR","List"
"Vernon ScottVideo | Scouts Report","Muskogee, OKMuskogee High School","CB","","NR","Signed"
"Jujuan MarshallVideo | Scouts Report","New York, NYWadleigh Secondary School","WR","","NR","List"
"James MarkosianVideo | Scouts Report","Draper, UTJuan Diego Catholic High School","OC","","NR","List"
"Vershawn CosbyVideo | Scouts Report","Winter Haven, FLWinter Haven High School","ILB","","NR","List"
"D'jon TillmanVideo | Scouts Report","Fairfield, CAVanden High School","WR","","NR","List"
"Howard McDonaldVideo | Scouts Report","Silverdale, WACentral Kitsap High School","RB","","NR","List"
"Osmond NicholasVideo | Scouts Report","Oceanside, CAOceanside High School","WR","","NR","Signed"
